Sheet: Sheet1
A1: 4322669 | B1: 1.1200000000000001 | C1: PT012H31M00S
A2: izquierda | B2: derecha | C2: 18/04/2019
A3: centro | B3: 960.13999999999999 | C3: 2019-04-18
A4: -32
A5: expr | B5: of:=[.A1]+[.B1] -> 4322670.1200000001
A6: average | B6: of:=AVERAGE([.A1:.B1]) -> 2161335.0600000001
A7: sum | B7: of:=SUM([.A1:.B1]) -> 4322670.1200000001
A8: product | B8: of:=PRODUCT([.A1:.B1]) -> 4841389.2800000003
A9: count | B9: of:=COUNT([.A1:.B1]) -> 2
A10: min | B10: of:=MIN([.A1:.B1]) -> 1.1200000000000001
A11: max | B11: of:=MAX([.A1:.B1]) -> 4322669
A12: abs | B12: of:=ABS([.A4]) -> 32
A13: stdev | B13: of:=STDEV([.A1:.B1]) -> 3056587.7707652776